[
  {
    "skill_id": "skill_noun_verb_recognition",
    "skill_name": "Noun vs Verb Recognition",
    "category": "classification",
    "subcategory": "part_of_speech",
    "description": "Distinguish whether a Hebrew token is functioning as a noun or a verb before applying morphology rules.",
    "prerequisite_skill_ids": [],
    "assessment_context": "isolated",
    "difficulty_band": "early_elementary",
    "mastery_signal_type": "recognition",
    "source_refs": ["R3:p5", "R1:p1"],
    "notes": "Placed first because later suffix rules depend on correct noun/verb classification."
  },
  {
    "skill_id": "skill_function_word_recognition",
    "skill_name": "Function Word Recognition",
    "category": "translation",
    "subcategory": "function_words",
    "description": "Recognize high-frequency prefixes, prepositions, conjunctions, particles, and object markers.",
    "prerequisite_skill_ids": [],
    "assessment_context": "phrase",
    "difficulty_band": "early_elementary",
    "mastery_signal_type": "recognition",
    "source_refs": ["R1:p1", "R2:worksheets", "R3:pp5-24"],
    "notes": "Best assessed inside phrases, not only as isolated gloss recall."
  },
  {
    "skill_id": "skill_shoresh_identification",
    "skill_name": "Shoresh Identification",
    "category": "morphology",
    "subcategory": "shoresh",
    "description": "Identify the root letters of a Hebrew word after ignoring non-root additions.",
    "prerequisite_skill_ids": ["skill_noun_verb_recognition"],
    "assessment_context": "isolated",
    "difficulty_band": "early_elementary",
    "mastery_signal_type": "parsing",
    "source_refs": ["R2:p1", "R2:worksheets", "R3:pp5-24"],
    "notes": "R2 provides the clearest direct evidence for this skill family."
  },
  {
    "skill_id": "skill_affix_segmentation",
    "skill_name": "Affix Segmentation",
    "category": "morphology",
    "subcategory": "segmentation",
    "description": "Split a token into prefix, shoresh, and suffix parts when those parts are instructionally meaningful.",
    "prerequisite_skill_ids": ["skill_shoresh_identification"],
    "assessment_context": "isolated",
    "difficulty_band": "late_elementary",
    "mastery_signal_type": "parsing",
    "source_refs": ["R2:p1", "R2:worksheets"],
    "notes": "Directly supported by the cut-apart worksheet design."
  },
  {
    "skill_id": "skill_prefix_handling",
    "skill_name": "Prefix Handling",
    "category": "morphology",
    "subcategory": "prefixes",
    "description": "Interpret high-value Hebrew prefixes that affect meaning, tense, or syntax.",
    "prerequisite_skill_ids": ["skill_affix_segmentation"],
    "assessment_context": "isolated",
    "difficulty_band": "late_elementary",
    "mastery_signal_type": "parsing",
    "source_refs": ["R2:worksheets", "R3:pp22-35"],
    "notes": "Includes conjunction-style and tense-sensitive prefixes."
  },
  {
    "skill_id": "skill_suffix_handling",
    "skill_name": "Suffix Handling",
    "category": "morphology",
    "subcategory": "suffixes",
    "description": "Interpret high-value Hebrew suffixes that affect possession, subject marking, or object marking.",
    "prerequisite_skill_ids": ["skill_affix_segmentation"],
    "assessment_context": "isolated",
    "difficulty_band": "late_elementary",
    "mastery_signal_type": "parsing",
    "source_refs": ["R2:worksheets", "R3:pp5-19", "R3:pp59-89", "R3:pp107-126"],
    "notes": "Suffix meaning depends on whether the word is a noun or verb."
  },
  {
    "skill_id": "skill_noun_possessive_suffix_recognition",
    "skill_name": "Noun Possessive Suffix Recognition",
    "category": "noun_morphology",
    "subcategory": "possessive_suffixes",
    "description": "Recognize attached endings on nouns that show ownership or possession.",
    "prerequisite_skill_ids": ["skill_noun_verb_recognition", "skill_suffix_handling"],
    "assessment_context": "isolated",
    "difficulty_band": "late_elementary",
    "mastery_signal_type": "parsing",
    "source_refs": ["R3:pp5-19", "R3:pp36-37", "R3:pp59", "R3:pp68-72"],
    "notes": "The curriculum explicitly sequences noun possession before much of the verb system."
  },
  {
    "skill_id": "skill_plural_handling",
    "skill_name": "Plural Handling",
    "category": "noun_morphology",
    "subcategory": "plurality",
    "description": "Distinguish true plurals, plural possession, and false-plural-looking forms.",
    "prerequisite_skill_ids": ["skill_noun_verb_recognition", "skill_suffix_handling"],
    "assessment_context": "isolated",
    "difficulty_band": "late_elementary",
    "mastery_signal_type": "mixed",
    "source_refs": ["R3:p16", "R3:p37", "R3:p72"],
    "notes": "False plural exceptions are explicitly taught as a confusion source."
  },
  {
    "skill_id": "skill_verb_past_suffix_recognition",
    "skill_name": "Verb Past Suffix Recognition",
    "category": "verb_morphology",
    "subcategory": "past_markers",
    "description": "Recognize past-tense verb endings and what subject they encode.",
    "prerequisite_skill_ids": ["skill_noun_verb_recognition", "skill_suffix_handling"],
    "assessment_context": "isolated",
    "difficulty_band": "middle_school",
    "mastery_signal_type": "parsing",
    "source_refs": ["R3:p7", "R3:pp60-61", "R3:p67", "R3:p70", "R3:p86"],
    "notes": "Includes regular past 3ms and suffixed past forms."
  },
  {
    "skill_id": "skill_verb_future_prefix_recognition",
    "skill_name": "Verb Future Prefix Recognition",
    "category": "verb_morphology",
    "subcategory": "future_markers",
    "description": "Recognize future-tense verb prefixes and what subject they encode.",
    "prerequisite_skill_ids": ["skill_noun_verb_recognition", "skill_prefix_handling"],
    "assessment_context": "isolated",
    "difficulty_band": "middle_school",
    "mastery_signal_type": "parsing",
    "source_refs": ["R3:pp22-35", "R3:pp57", "R3:pp73-76"],
    "notes": "The tav-prefix family is explicitly context-sensitive."
  },
  {
    "skill_id": "skill_tense_recognition",
    "skill_name": "Tense Recognition",
    "category": "verb_morphology",
    "subcategory": "tense",
    "description": "Determine whether a form is read as past, future, or present/habitual in the curriculum's grammar system.",
    "prerequisite_skill_ids": [
      "skill_verb_past_suffix_recognition",
      "skill_verb_future_prefix_recognition"
    ],
    "assessment_context": "isolated",
    "difficulty_band": "middle_school",
    "mastery_signal_type": "recognition",
    "source_refs": ["R3:pp22-35", "R3:pp60-61", "R3:pp118-126"],
    "notes": "Should not be separated from ambiguity handling in later stages."
  },
  {
    "skill_id": "skill_person_gender_number_recognition",
    "skill_name": "Person / Gender / Number Recognition",
    "category": "verb_morphology",
    "subcategory": "agreement",
    "description": "Identify the subject slot encoded by a verb form, including person, gender, and number.",
    "prerequisite_skill_ids": ["skill_tense_recognition"],
    "assessment_context": "isolated",
    "difficulty_band": "middle_school",
    "mastery_signal_type": "parsing",
    "source_refs": ["R3:pp22-35", "R3:pp57-61", "R3:pp67-88"],
    "notes": "Especially important for ambiguous future forms and imperative families."
  },
  {
    "skill_id": "skill_vav_hahipuch_recognition",
    "skill_name": "Vav-Hahipuch Recognition",
    "category": "verb_morphology",
    "subcategory": "vav_patterns",
    "description": "Recognize when prefixed vav changes the expected reading of a verb form in narrative sequence.",
    "prerequisite_skill_ids": ["skill_tense_recognition", "skill_prefix_handling"],
    "assessment_context": "phrase",
    "difficulty_band": "middle_school",
    "mastery_signal_type": "parsing",
    "source_refs": ["R3:pp23-24", "R3:pp34-35"],
    "notes": "Best assessed in phrase context, not as a purely isolated visual cue."
  },
  {
    "skill_id": "skill_direct_command_recognition",
    "skill_name": "Direct Command Recognition",
    "category": "verb_morphology",
    "subcategory": "imperative",
    "description": "Distinguish imperative forms from superficially similar past or future forms.",
    "prerequisite_skill_ids": [
      "skill_tense_recognition",
      "skill_person_gender_number_recognition"
    ],
    "assessment_context": "phrase",
    "difficulty_band": "advanced",
    "mastery_signal_type": "parsing",
    "source_refs": ["R3:pp78-89"],
    "notes": "Command recognition should be context-sensitive because some forms overlap with past plural."
  },
  {
    "skill_id": "skill_present_habitual_recognition",
    "skill_name": "Present / Habitual Recognition",
    "category": "verb_morphology",
    "subcategory": "present_habitual",
    "description": "Recognize present or habitual verb patterns taught in the curriculum.",
    "prerequisite_skill_ids": ["skill_tense_recognition"],
    "assessment_context": "phrase",
    "difficulty_band": "advanced",
    "mastery_signal_type": "parsing",
    "source_refs": ["R3:pp118-124"],
    "notes": "Should not be collapsed into the past/future binary."
  },
  {
    "skill_id": "skill_verb_object_suffix_recognition",
    "skill_name": "Verb Object Suffix Recognition",
    "category": "verb_morphology",
    "subcategory": "attached_objects",
    "description": "Recognize object pronouns attached to verbs and separate them from subject-marking endings.",
    "prerequisite_skill_ids": [
      "skill_suffix_handling",
      "skill_person_gender_number_recognition"
    ],
    "assessment_context": "phrase",
    "difficulty_band": "advanced",
    "mastery_signal_type": "parsing",
    "source_refs": ["R3:pp89", "R3:pp107-125"],
    "notes": "This is a high-value explanation skill for tutor feedback."
  },
  {
    "skill_id": "skill_literal_translation",
    "skill_name": "Literal Translation",
    "category": "translation",
    "subcategory": "token_level",